{
  "solution_shape": "",
  "solution_shape_basis": [],
  "solution_focus_tags": [],
  "proto_focus_tags": [],
  "prd_focus_tags": [],
  "existing_scope_refs": [],
  "new_scope_refs": [],
  "current_version": "",
  "locked_by_pm": false,
  "lock_scope_tags": [],
  "modules": [
    {
      "module_id": "",
      "module_name": "",
      "module_goal": "",
      "module_outcomes": [],
      "pages": [
        {
          "page_id": "",
          "human_page_code": "",
          "page_name": "",
          "page_type": "",
          "page_goal": "",
          "layout_blocks": [],
          "outcomes": [],
          "key_elements": [],
          "key_actions": [],
          "constraints": [],
          "actions": [
            {
              "action_id": "",
              "anchor_id": "",
              "action_name": "",
              "human_title": "",
              "source_facts": [],
              "prd_locator": {
                "heading_path": []
              },
              "prototype_locator": {
                "file": "",
                "page_code": "",
                "marker": ""
              }
            }
          ]
        }
      ]
    }
  ],
  "out_of_scope": [],
  "non_blocking_todos": [],
  "notes": []
}
